Handle,Title,Body (HTML),Vendor,Type,Tags,Published,Option1 Name,Option1 Value,Option2 Name,Option2 Value,Option3 Name,Option3 Value,Variant SKU,Variant Grams,Variant Inventory Tracker,Variant Inventory Qty,Variant Inventory Policy,Variant Fulfillment Service,Variant Price,Variant Compare At Price,Variant Requires Shipping,Variant Taxable,Variant Barcode,Image Src,Image Position,Image Alt Text,Gift Card,SEO Title,SEO Description,Google Shopping / Google Product Category,Google Shopping / Gender,Google Shopping / Age Group,Google Shopping / MPN,Google Shopping / AdWords Grouping,Google Shopping / AdWords Labels,Google Shopping / Condition,Google Shopping / Custom Product,Google Shopping / Custom Label 0,Google Shopping / Custom Label 1,Google Shopping / Custom Label 2,Google Shopping / Custom Label 3,Google Shopping / Custom Label 4,Variant Image,Variant Weight Unit,Variant Tax Code,Cost per item
"cobb-tuning-logo-beanie-black-c-co-beaniecobb","Cobb Tuning Logo Beanie - Black C-CO-BEANIECOBB","<p><span style='color: rgb(111, 111, 111); font-family: Arial, &quot;Helvetica Neue&quot;, Helvetica, sans-serif; font-size: 13px; line-height: 22.1px;'>COBB Knit Black Beanie With White Cobb Logo.&nbsp;</span><span style='color: rgb(111, 111, 111); font-family: Arial, &quot;Helvetica Neue&quot;, Helvetica, sans-serif; font-size: 13px; line-height: 22.1px;'>Stay warm and cool at the same time with a COBB Beanie!</span></p><ul class='no-b-margin' style='color: rgb(111, 111, 111); font-family: Arial, &quot;Helvetica Neue&quot;, Helvetica, sans-serif; font-size: 13px; line-height: 18.85px; margin-bottom: 0px !important;'><li><span style='font-weight: inherit;'>100% hypoallergenic acrylic two-ply knit cap</span></li><li><span style='font-weight: inherit;'>One Size Fits All</span></li><li><span style='font-weight: inherit;'>COBB Embroidery</span></li><li><span style='font-weight: inherit;'>Hand washable</span></li><li><span style='font-weight: inherit;'>Approx. 8'</span></li></ul>","COBB Hard Parts","Clothing","Clothing, COBB Hard Parts","TRUE","","","","","","","","","","","deny","manual","15.92","","TRUE","TRUE","","https://www.part-box.com/image/cache/catalog/cobb/C-CO-BEANIECOBB-492x492_0.jpg","1","Cobb Tuning Logo Beanie - Black C-CO-BEANIECOBB","","Cobb Tuning Logo Beanie - Black","COBB Knit Black Beanie With White Cobb Logo. Stay warm and cool at the same time with a COBB Beanie!

100% hypoallergenic acrylic two-ply knit cap
One Size Fits All
COBB Embroidery
Hand washable
Approx. 8'","","","","","","","","","","","","","","","","",""
"cobb-flexfit-pro-formance-cobb-cap-l-xl-c-co-cap-black-l-xl","Cobb Flexfit Pro-Formance COBB Cap - L/XL C-CO-Cap-Black-L-XL","<p><span style='color: rgb(111, 111, 111); font-family: Arial, &quot;Helvetica Neue&quot;, Helvetica, sans-serif; font-size: 13px; line-height: 22.1px;'>Lightweight, serge polyspun fabric has the look and feel of wool. Mid-profile cap, 3 1/4' crown with six eyelets. PermacCurv PE visor with 8 rows of stitching, fused hard buckram front panels, hypoallergenic and moisture wicking ability, and superior drying with matching under-visor. This COBB cap features a 3-D COBB logo embroidered on the wearer's left side. Available in 2 sizes: S/M: 6 3/4' - 7 1/4' L/XL: 7 1/8' - 7 5/8'</span></p><ul class='no-b-margin' style='color: rgb(111, 111, 111); font-family: Arial, &quot;Helvetica Neue&quot;, Helvetica, sans-serif; font-size: 13px; line-height: 18.85px; margin-bottom: 0px !important;'><li><span style='font-weight: inherit;'>Embroidered White 3-D COBB Logo</span></li><li><span style='font-weight: inherit;'>6580 Flexfit Pro-Formance Cap</span></li><li><span style='font-weight: inherit;'>97% Polyester / 3% Spandex</span></li><li><span style='font-weight: inherit;'>Fitted Stretch Fit Closure</span></li><li><span style='font-weight: inherit;'>Moisture Wicking, Dries Quickly, Circulates Air for Coolness</span></li></ul><p><br></p>","COBB Hard Parts","Clothing","Clothing, COBB Hard Parts","TRUE","","","","","","","","","","","deny","manual","26.54","","TRUE","TRUE","","https://www.part-box.com/image/cache/catalog/cobb/C-CO-Cap-Black-L-XL-492x492_0.jpg","1","Cobb Flexfit Pro-Formance COBB Cap - L/XL C-CO-Cap-Black-L-XL","","Cobb Flexfit Pro-Formance COBB Cap - L/XL","Lightweight, serge polyspun fabric has the look and feel of wool. Mid-profile cap, 3 1/4' crown with six eyelets. PermacCurv PE visor with 8 rows of stitching, fused hard buckram front panels, hypoallergenic and moisture wicking ability, and superior drying with matching under-visor. This COBB cap features a 3-D COB","","","","","","","","","","","","","","","","",""
"forge-beany-hat-navy-blue-fmbhn","Forge BEANY HAT - NAVY BLUE FMBHN","","Forge Motorsport","Clothing","Clothing, Forge Motorsport","TRUE","","","","","","","","","","","deny","manual","13.88","","TRUE","TRUE","","https://www.part-box.com/image/cache/catalog/forge/FMBHN-492x492_0.jpg","1","Forge BEANY HAT - NAVY BLUE FMBHN","","Forge BEANY HAT - NAVY BLUE","","","","","","","","","","","","","","","","","",""
"cobb-tuning-logo-t-shirt-men-s-black-c-co-blackcobb","Cobb Tuning Logo T-Shirt - Men's Black C-CO-BLACKCOBB","<p><span style='color: rgb(111, 111, 111); font-family: Arial, &quot;Helvetica Neue&quot;, Helvetica, sans-serif; font-size: 13px; line-height: 22.1px;'>Simple and powerful, the COBB logo speaks for itself and lets others know you're not to be trifled with.</span></p><p><span style='color: rgb(111, 111, 111); font-family: Arial, &quot;Helvetica Neue&quot;, Helvetica, sans-serif; font-size: 13px; line-height: 22.1px;'>Hanes Beefy-T has set the standard for T-shirt comfort and quality. Today it's better than ever, offering greater durability and less shrinkage than you'll get with ordinary tees.</span></p><ul class='no-b-margin' style='color: rgb(111, 111, 111); font-family: Arial, &quot;Helvetica Neue&quot;, Helvetica, sans-serif; font-size: 13px; line-height: 18.85px; margin-bottom: 0px !important;'><li><span style='font-weight: inherit;'>Ultra-soft premium cotton feels great against your skin.</span></li><li><span style='font-weight: inherit;'>6.1 oz.</span></li><li><span style='font-weight: inherit;'>Full cut provides roomier fit (Preshrunk to stay true to size).</span></li><li><span style='font-weight: inherit;'>Non-chafe fabric taping reinforces neck and shoulders.</span></li><li><span style='font-weight: inherit;'>Durable double stitching trims sleeves and bottom hem.</span></li></ul>","COBB Hard Parts","Clothing","Clothing, COBB Hard Parts","TRUE","","","","","","","","","","","deny","manual","21.23","","TRUE","TRUE","","https://www.part-box.com/image/cache/catalog/cobb/C-CO-BLACKCOBB-492x492_0.jpg","1","Cobb Tuning Logo T-Shirt - Men's Black C-CO-BLACKCOBB","","Cobb Tuning Logo T-Shirt - Men's Black","Simple and powerful, the COBB logo speaks for itself and lets others know you're not to be trifled with.

Hanes Beefy-T has set the standard for T-shirt comfort and quality. Today it's better than ever, offering greater durability and less shrinkage than you'll get with ordinary tees.

Ultra-soft premium cotton feel","","","","","","","","","","","","","","","","",""
"cobb-flexfit-pro-formance-cobb-cap-s-m-c-co-cap-black-s-m","Cobb Flexfit Pro-Formance COBB Cap - S/M C-CO-Cap-Black-S-M","<p><span style='color: rgb(111, 111, 111); font-family: Arial, &quot;Helvetica Neue&quot;, Helvetica, sans-serif; font-size: 13px; line-height: 22.1px;'>Lightweight, serge polyspun fabric has the look and feel of wool. Mid-profile cap, 3 1/4' crown with six eyelets. PermacCurv PE visor with 8 rows of stitching, fused hard buckram front panels, hypoallergenic and moisture wicking ability, and superior drying with matching under-visor. This COBB cap features a 3-D COBB logo embroidered on the wearer's left side. Available in 2 sizes: S/M: 6 3/4' - 7 1/4' L/XL: 7 1/8' - 7 5/8'</span></p><ul class='no-b-margin' style='color: rgb(111, 111, 111); font-family: Arial, &quot;Helvetica Neue&quot;, Helvetica, sans-serif; font-size: 13px; line-height: 18.85px; margin-bottom: 0px !important;'><li><span style='font-weight: inherit;'>Embroidered White 3-D COBB Logo</span></li><li><span style='font-weight: inherit;'>6580 Flexfit Pro-Formance Cap</span></li><li><span style='font-weight: inherit;'>97% Polyester / 3% Spandex</span></li><li><span style='font-weight: inherit;'>Fitted Stretch Fit Closure</span></li><li><span style='font-weight: inherit;'>Moisture Wicking, Dries Quickly, Circulates Air for Coolness</span></li></ul><p><br></p>","COBB Hard Parts","Clothing","Clothing, COBB Hard Parts","TRUE","","","","","","","","","","","deny","manual","26.54","","TRUE","TRUE","","https://www.part-box.com/image/cache/catalog/cobb/C-CO-Cap-Black-L-XL-492x492_0.jpg","1","Cobb Flexfit Pro-Formance COBB Cap - S/M C-CO-Cap-Black-S-M","","Cobb Flexfit Pro-Formance COBB Cap - S/M","Lightweight, serge polyspun fabric has the look and feel of wool. Mid-profile cap, 3 1/4' crown with six eyelets. PermacCurv PE visor with 8 rows of stitching, fused hard buckram front panels, hypoallergenic and moisture wicking ability, and superior drying with matching under-visor. This COBB cap features a 3-D COB","","","","","","","","","","","","","","","","",""
"forge-fleece-navy-blue-sizes-s-m-l-xl-xxl-fmfn","Forge FLEECE - NAVY BLUE SIZES S, M, L, XL, XXL FMFN","","Forge Motorsport","Clothing","Clothing, Forge Motorsport","TRUE","","","","","","","","","","","deny","manual","44.09","","TRUE","TRUE","","https://www.part-box.com/image/cache/catalog/forge/FMFN-492x492_0.jpg","1","Forge FLEECE - NAVY BLUE SIZES S, M, L, XL, XXL FMFN","","Forge FLEECE - NAVY BLUE SIZES S, M, L, XL, XXL","","","","","","","","","","","","","","","","","",""
